{
  "schema_version": 1,
  "receipt_type": "system_governance_bootstrap",
  "trust_mode": "local_controlled_same_user",
  "security_caveat": "same_os_user_can_access_private_key_not_host_native_attestation",
  "explicit_user_authorization": true,
  "authorization_source": "{{EXTERNAL_USER_AUTHORIZATION_ID}}",
  "issuer": "{{EXTERNAL_LOCAL_SIGNER_ID}}",
  "key_id": "{{EXTERNAL_KEY_ID}}",
  "key_fingerprint_sha256": "{{PINNED_RAW_ED25519_PUBLIC_KEY_SHA256}}",
  "agent_handle": "{{ASSIGNED_AGENT_HANDLE}}",
  "assigned_model": "gpt-5.6-sol",
  "assigned_reasoning_effort": "medium",
  "role": "implementation",
  "module_key": "{{PENDING_MODULE_KEY}}",
  "stable_title": "{{PENDING_STABLE_TITLE}}",
  "project_root": "{{ABSOLUTE_PROJECT_ROOT}}",
  "replay_state_path": "{{EXACT_CANONICAL_ABSOLUTE_REPLAY_STATE_PATH}}",
  "owned_paths": ["{{EXACT_CANONICAL_ABSOLUTE_OWNED_PATH}}"],
  "issued_at": "{{UTC_ISSUED_AT}}",
  "not_before": "{{UTC_NOT_BEFORE}}",
  "expires_at": "{{UTC_EXPIRES_AT}}",
  "nonce": "{{UNIQUE_SHA256_NONCE}}",
  "receipt_id": "{{UNIQUE_RECEIPT_ID}}",
  "baseline_sha256": "{{BASELINE_SHA256}}",
  "policy_sha256": "{{POLICY_SHA256}}",
  "candidate_sha256": "{{CANDIDATE_SHA256}}",
  "authority_matrix_sha256": "{{AUTHORITY_MATRIX_SHA256}}",
  "operation_id": "{{UNIQUE_BOOTSTRAP_OPERATION_ID}}",
  "one_time": true,
  "post_bootstrap_authority": "host-native-module-lease-required"
}
